Gene,transcript,hgvsc,hgvsp,Germline classification,paper_id,target_gene,gene,variant_c,variant_p,source_type,frequency,location_in_paper,summary,reasoning,fulltext_source,phenotype_data,phenotype_location,phenotype_reasoning,patient_count,patient_data,patient_location,patient_reasoning
EEF1A2,NM_001958.5,c.1267C>T,p.Arg423Cys,Pathogenic/Likely pathogenic,PMC4947865,EEF1A2,EEF1A2,c.1267C>T,p.Arg423Cys,original_data,"1 case (this study, case 7)",Results section: Case 7; Table 1; Table 3 (C1267T / R423C),De novo missense variant reported in this study (case 7).,The 'Case 7' narrative reports 'c.1267 C>T (p.R423C)' in EEF1A2. Table 1 records 'Arg423Cys' for this study case 7 and Table 3 lists 'C1267T' and 'R423C' with 1 case. Standardized to HGVS c.1267C>T and p.Arg423Cys.,Unknown,"Seizures, epilepsy (intractable), epileptic spasms/infantile spasms, myoclonic seizures, myoclonic-tonic seizures, tonic seizures, tonic-clonic seizures, focal seizures, epileptic encephalopathy, global developmental delay, intellectual disability/developmental impairment, no speech (nonverbal), does not walk (non-ambulatory), choreic movements, irritability, disturbed sleep, food allergies, eosinophilic esophagitis, pancreatitis, teeth grinding (bruxism), hand flapping",Results > Clinical findings/case studies > Case 7; Table 1 row for Arg423Cys (case 7),The target variant c.1267C>T (p.Arg423Cys) is explicitly reported in Case 7; clinical symptoms are described in the Case 7 narrative and briefly summarized in Table 1.,1,"[{""patient_id"": ""Case 7"", ""sex"": ""Male"", ""age"": ""5 years"", ""seizure_onset"": ""4 months"", ""seizure_status"": ""Ongoing intractable seizures; multiple daily seizures"", ""phenotypes"": ""Seizures (multiple types), focal seizures, epileptic spasms/infantile spasms, myoclonic seizures, myoclonic-tonic seizures, tonic seizures, tonic-clonic seizures, global developmental delay, no speech (nonverbal), non-ambulatory (does not walk), choreic movements, irritability, disturbed sleep, food allergies, eosinophilic esophagitis, pancreatitis, teeth grinding (bruxism), hand flapping""}]",Results > Clinical findings/case studies > Case 7; Table 1 row for Arg423Cys,"Only Case 7 is stated to carry the heterozygous EEF1A2 c.1267C>T (p.Arg423Cys) variant; the text provides sex, age, seizure onset, seizure course/status, and multiple clinical symptoms."
EEF1A2,NM_001958.5,c.796C>T,p.Arg266Trp,Pathogenic/Likely pathogenic,PMC8268798,EEF1A2,EEF1A2,Not specified,p.Arg266Trp,review,Not specified,"Section 4.6 (Arginine Mono-ADP-Ribosylation), final paragraph: 'pathogenic p.R266W eEF1A2 variant' [88]",EEF1A2 p.Arg266Trp cited as a pathogenic variant reported in patients.,"In Section 4.6, the authors note that 'a recent genetic study reported that the first three patients diagnosed with a pathogenic p.R266W eEF1A2 variant showed marked clinical heterogeneity [88].' This is a cited patient variant; no cDNA is provided. Classified as review because it is included in discussion of PTMs and disease literature rather than original case reporting. Confidence High.",Unknown,Not found,Section 4.6 (mention of first three patients with p.R266W) and elsewhere in provided text,"The paper text only states that the first three patients with pathogenic p.R266W showed marked clinical heterogeneity, without listing any specific clinical symptoms for those patients.",0,,Section 4.6,"No individual-level patient descriptions are provided (no patient identifiers, sex, age, seizure onset/status, or explicit clinical symptoms) for carriers of EEF1A2 p.Arg266Trp in the provided excerpt."
EEF1A2,NM_001958.5,c.796C>T,p.Arg266Trp,Pathogenic/Likely pathogenic,PMC7292794,EEF1A2,EEF1A2,Not specified,p.Arg266Trp,original_data,n=3,Results: 'Whole exome and targeted resequencing' paragraph 1,Recurrent de novo missense variant reported in this cohort.,The Results section lists p.R266W as recurrent with n=3 among the 14 patients identified in this study. cDNA not provided in the excerpt. Classified as original_data. Confidence high.,Unknown,"Global developmental delay, intellectual disability (moderate to profound), expressive language impairment, speech delay/nonverbal, impaired motor development, delayed walking, non-ambulatory, ataxic gait, developmental regression, hypotonia (truncal/generalized; including neonatal hypotonia), movement disorder (dystonia, chorea/choreoathetosis/choreiform movements), epilepsy/seizures (including myoclonic, generalized tonic-clonic, absence, tonic, epileptic spasms, hemiclonic, clonic), neurodegeneration, autism/autistic features",Results/Clinical characteristics (cohort summary) and Discussion paragraph describing the three p.Arg266Trp patients (patients 10–12),"The paper provides cohort-level clinical symptoms and then explicitly describes three individuals with the recurrent p.Arg266Trp (p.R266W) variant, including their developmental, seizure, and movement-disorder phenotypes.",3,"[{""patient_id"": ""Patient 10"", ""sex"": ""Male"", ""age"": ""1 year"", ""seizure_onset"": ""4 months"", ""seizure_status"": ""Seizures present (early-onset; later absence seizures described)"", ""phenotypes"": ""Moderate global developmental delay, seizures (hemiclonic; later absence seizures), No movement disorder""}, {""patient_id"": ""Patient 11"", ""sex"": ""Female"", ""age"": ""10 years"", ""seizure_onset"": ""Not reported"", ""seizure_status"": ""No seizures"", ""phenotypes"": ""Severe global developmental delay/intellectual disability, neurodegeneration, movement disorder (chorea)""}, {""patient_id"": ""Patient 12"", ""sex"": ""Female"", ""age"": ""10 years"", ""seizure_onset"": ""1 week"", ""seizure_status"": ""Seizures present (early-onset; later tonic seizures described)"", ""phenotypes"": ""Profound intellectual disability, seizures (clonic; later tonic seizures), movement disorder (choreiform movements)""}]","Discussion section: paragraph beginning 'For instance, within our cohort are the first three patients with a p.R266W variant...' (patients 10–12)","Three individual patients with p.Arg266Trp are explicitly described with age, sex (for patients 10 and 12; and patient 11 referred to as 'her'), seizure presence/absence and onset (for patients 10 and 12), and key clinical symptoms (developmental delay/ID severity, movement disorder, neurodegeneration)."
EEF1A2,NM_001958.5,c.370G>A,p.Glu124Lys,Pathogenic/Likely pathogenic,PMC4947865,EEF1A2,EEF1A2,c.370G>A,p.Glu124Lys,original_data,"1 case (this study, case 6)",Results section: Case 6; Table 1; Table 3 (G370A / E124K),De novo missense variant reported in this study (case 6).,"In 'Case 6', the manuscript states 'c.370G->A (p.E124K)' in EEF1A2. Table 1 lists 'Glu124Lys' for this study case 6, and Table 3 lists 'G370A' and 'E124K' with 1 case. Extracted as original_data with high confidence.",Unknown,"seizures, epilepsy, myoclonic seizures, absence seizures, language delay, comprehension delay, intellectual disability, no hypotonia","Results → Clinical findings/case studies → Case 6; Table 1 row for Glu124Lys (this study, case 6); Discussion (mentions moderate ID and seizure-free for years for case 6)","The target variant c.370G>A (p.Glu124Lys) corresponds to Case 6 and the Table 1 Glu124Lys entry, which explicitly describe seizure types and neurodevelopmental features; hypotonia is explicitly stated to be absent.",1,"[{""patient_id"": ""Case 6"", ""sex"": ""Female"", ""age"": ""10 years"", ""seizure_onset"": ""3 months"", ""seizure_status"": ""Absence seizures controlled (and noted to have had no seizures for a number of years)"", ""phenotypes"": ""seizures, myoclonic seizures, absence seizures, language delay, comprehension delay, intellectual disability, no hypotonia""}]","Results → Clinical findings/case studies → Case 6; Table 1 (Glu124Lys, this study case 6); Discussion (case 6 described as milder, moderate ID, no seizures for years)","Only one individual with c.370G>A (p.Glu124Lys) is described (Case 6). Sex, age, seizure onset/type/control, and neurodevelopmental phenotype are explicitly stated; duplicated summary in Table 1 was merged."
EEF1A2,NM_001958.5,c.364G>A,p.Glu122Lys,Pathogenic/Likely pathogenic,PMC10855229,EEF1A2,EEF1A2,c.364G>A,p.Glu122Lys,original_data,Not specified,"Introduction (paragraph beginning 'The E122K mutation (c.364G>A, p.Glu122Lys) has been described...')",Paper’s primary modeled human EEF1A2 variant E122K given in HGVS cDNA and protein notation.,"The Introduction explicitly states the most common clinical mutation as 'E122K (c.364G>A, p.Glu122Lys)'. Because the study generates and phenotypes a CRISPR mouse model to recapitulate this clinical EEF1A2 mutation, this variant is part of the paper’s original study focus (original_data). HGVS cDNA and protein are directly provided; no construction is needed. Confidence: High.",Unknown,"epilepsy, seizures, early-onset epilepsy, developmental delay, developmental regression, developmental arrest, intellectual disability (moderate to severe), movement disorder, ataxia, chorea, dystonia, hypotonia, non-verbal/minimally verbal, microcephaly, autism/autistic behaviours, behavioural problems, self-injurious behaviour, sleep abnormalities, inability to walk, delayed motor development","Introduction paragraph describing E122K human phenotype (""The E122K mutation... presents with a consistently severe phenotype...""), plus earlier general EEF1A2-missense phenotype summary in Introduction","The text explicitly summarizes clinical features reported in individuals with the EEF1A2 p.Glu122Lys variant, including epilepsy/seizures (early onset), neurodevelopmental impairment, motor/movement abnormalities, and behavioral/sleep/autistic features.",0,,Throughout provided paper text (human E122K described only as aggregate summary; no individual case vignettes with sex/age/onset per patient),"No individual patients with p.Glu122Lys are delineated with patient-level identifiers or discrete age/sex/seizure-onset details; only cohort-level statements (e.g., 'at least 11 individuals', 'three cases')."
EEF1A2,NM_001958.5,c.364G>A,p.Glu122Lys,Pathogenic/Likely pathogenic,PMC10515156,EEF1A2,EEF1A2,Not specified,p.Glu122Lys,cited_literature,Not specified,"Introduction: sentence 'Three common disease-causing mutations in EEF1A2 ... are G70S, E122K, D252H'",E122K listed as a common disease-causing EEF1A2 mutation in prior patients.,E122K is mentioned in the context of de novo disease mutations reported previously (refs 6–9) and described as commonly reported in patients. The paper does not claim discovery of this variant in new human subjects here and provides no cDNA HGVS.,Unknown,"autism, epilepsy, intellectual disability, attention deficit hyperactivity disorder (ADHD), sleep disturbances, global neurodevelopmental delay, drug-resistant seizures","Introduction (neurological comorbidities in ASD; EEF1A2 mutations in patients), Discussion (patient phenotype summary for EEF1A2 mutations; microdeletion cohort description)","The paper mentions patient clinical features associated with EEF1A2 mutations including the E122K (p.Glu122Lys) variant, but describes them in aggregate (not per individual). Only clinical symptoms were extracted; imaging/EEG/treatment details were not included.",0,,Entire provided paper text,"No individual patients with EEF1A2 p.Glu122Lys (E122K) are explicitly described with patient-level details (sex, age, seizure onset/status, individual phenotype list). Statements are general/aggregate across patients or cohorts."
EEF1A2,NM_001958.5,c.364G>A,p.Glu122Lys,Pathogenic/Likely pathogenic,PMC4947865,EEF1A2,EEF1A2,c.364G>A,p.Glu122Lys,original_data,"1 case (this study, case 5); recurrent overall (2 cases total in Table 3)","Results section: Case 5; Table 1 (this study case 5 and Nakajima et al. 2015); Table 3 (G364A / E122K, 2 cases)",De novo missense variant reported in this study (case 5) and also present in prior literature.,"The Results 'Case 5' section reports 'c364G->A (p.E122K)' (missing dot in text, interpreted as c.364G>A). Table 1 includes 'Glu122Lys' for this study case 5 and also another 'Glu122Lys' entry attributed to Nakajima et al. 2015. Table 3 lists 'G364A' / 'E122K' with 'No. cases 2', consistent with one case from this study plus one previously reported; thus the variant is extracted here as original_data (because it occurs in a new case in this paper) with frequency noting recurrence.",Unknown,"Hypotonia, gross motor delay, developmental delay, speech delay (nonverbal/no speech), seizures, infantile spasms, microcephaly","Results > Clinical findings/case studies > Case 5; Table 1 (row: Glu122Lys, This study, case 5)","Case 5 carries the target variant (p.Glu122Lys) and is described with neonatal hypotonia, gross motor and global developmental delay, absent speech, seizures starting in infancy with features consistent with infantile spasms, and head circumference below the 2nd centile.",1,"[{""patient_id"": ""Case 5 (This study)"", ""sex"": ""Female"", ""age"": ""6 years"", ""seizure_onset"": ""10 weeks"", ""seizure_status"": ""Improved (better controlled) after treatment (still has history of seizures)"", ""phenotypes"": ""Hypotonia, gross motor delay, developmental delay, speech delay (no speech/nonverbal), seizures, infantile spasms, microcephaly""}]","Results > Clinical findings/case studies > Case 5; Table 1 (Glu122Lys, This study, case 5)",Only one individual in the provided text is explicitly described with the specified variant c.364G>A (p.Glu122Lys): Case 5. Patient-level clinical symptoms and seizure onset are directly stated there and summarized in Table 1.
EEF1A2,NM_001958.5,c.293T>G,p.Phe98Cys,Likely pathogenic,PMC10869706,EEF1A2,EEF1A2,Not specified,p.Phe98Cys,cited_literature,Not specified,Results section: subsection 'Chp1 binds and stabilizes eEF1A F98C missense variant' (variant list in text); Fig. 5 title/legend and Discussion (multiple mentions of 'F98C'),EEF1A2 pathogenic variant F98C repeatedly discussed/assayed.,"F98C is one of the explicitly enumerated EEF1A2 patient variants and is the focus of functional/interaction assays in yeast. The paper frames these as 'mutations from patients' and cites prior literature, so the variant itself is cited_literature (even though it is experimentally modeled in yeast). No HGVS cDNA notation is provided in the excerpt; only the amino-acid substitution is stated.",Unknown,Not found,Main text (Results/Discussion) where EEF1A2 variants including F98C are mentioned,"The paper references that EEF1A2 sequence variants (including F98C / p.Phe98Cys) have been found in patients with neurodevelopmental epilepsy/intellectual disability and mentions 'epileptic-dyskinetic encephalopathy' and 'cortical/cerebellar brain atrophy', but it does not describe observed clinical symptoms for any specific patient carrying p.Phe98Cys, nor does it provide explicit symptom presence/absence in individuals.",0,,Main text (Fig. 5 section and surrounding paragraphs),"No individual-level patient descriptions are provided (no patient IDs, sex, age, seizure onset/status, or case phenotypes). The article is primarily mechanistic/functional in yeast and only generally cites prior patient associations without presenting patient data."
EEF1A2,NM_001958.5,c.271G>A,p.Asp91Asn,Pathogenic,PMC10869706,EEF1A2,EEF1A2,Not specified,p.Asp91Asn,cited_literature,Not specified,Results section: subsection 'Chp1 binds and stabilizes eEF1A F98C missense variant' (variant list in text) and Fig. 5 legend/panel a-b,EEF1A2 pathogenic variant listed as D91N in patient-associated variant set.,"D91N appears in the same explicit list of EEF1A2 patient-associated variants (G70S, D91N, F98C, etc.) used to generate mutants for experiments. The text attributes these as variants found in patients (with citations 32–34) rather than discovered here, so cited_literature. Only protein-level notation is given; no cDNA change is stated.",Unknown,Not found,Main text (Introduction/Results/Discussion) mentioning EEF1A2 patient variants (including D91N) but without individual clinical symptom descriptions,"The provided paper text discusses EEF1A2 variants (including D91N/p.Asp91Asn) in the context of prior patient reports (e.g., 'epileptic-dyskinetic encephalopathy', 'neurodevelopmental epilepsy and intellectual disability', 'cortical/cerebellar brain atrophy') but does not describe observed clinical symptoms for D91N patients in the excerpt; it also contains no patient-level clinical descriptions.",0,,Entire provided paper text,"No individual patients with EEF1A2 p.Asp91Asn (D91N) are described (no patient IDs, sex, age, seizure onset/status, or clinical symptom lists). The text is focused on yeast/biochemical experiments and only references human disease categories without case-level data."
EEF1A2,NM_001958.5,c.271G>A,p.Asp91Asn,Pathogenic,PMC4947865,EEF1A2,EEF1A2,c.271G>A,p.Asp91Asn,original_data,"1 case (this study, case 3)",Results section: Case 3; Table 1; Table 3 (G271A / D91N),De novo missense variant reported in this study (case 3).,The 'Case 3' description states a heterozygous de novo 'c.271G->A (p.D91N)' mutation in EEF1A2. Table 1 includes 'Asp91Asn' for this study case 3; Table 3 records 'G271A' and 'D91N' with 1 case. Extracted as original_data with high confidence.,Unknown,"Seizures, epileptic encephalopathy, epileptic spasms/infantile spasms-like seizures (clusters), head drops, atypical absence seizures, developmental delay, global developmental delay, motor delay, severe intellectual disability, hypotonia, nonverbal/no speech, inability to walk independently, gait impairment (unable to walk), reduced bone density, fractures, scoliosis",Results → Clinical findings/case studies → Case 3; Table 1 (row for Asp91Asn),The text explicitly describes clinical features for Case 3 with the EEF1A2 p.Asp91Asn (c.271G>A) variant; only patient-observed symptoms/signs were extracted.,1,"[{""patient_id"": ""Case 3"", ""sex"": ""Female"", ""age"": ""14-year-old"", ""seizure_onset"": ""2 years"", ""seizure_status"": ""Ongoing seizures; resistant to medication"", ""phenotypes"": ""Seizures, epileptic spasms/infantile spasms-like seizures (clusters), head drops, atypical absence seizures, developmental delay, global developmental delay, motor delay, hypotonia, nonverbal/no speech, inability to walk independently, reduced bone density, fractures, scoliosis""}]",Results → Clinical findings/case studies → Case 3; Table 1 (Asp91Asn),"Only one individual (Case 3) is reported with c.271G>A (p.Asp91Asn); demographics, seizure onset/status, and clinical symptoms are explicitly described and were extracted."
EEF1A2,NM_001958.5,c.208G>A,p.Gly70Ser,Pathogenic,PMC12614217,EEF1A2,EEF1A2,Not specified,p.Gly70Ser,review,Not specified,"Discussion section, paragraph beginning 'Thirty de novo mutations of eEF1A2 were found associated with developmental and epileptic encephalopathies...'",EEF1A2 missense variant p.Gly70Ser mentioned as an example of a mutation-prone residue.,"The paper explicitly names 'G70S' as a de novo mutation in eEF1A2 while discussing previously reported disease-associated mutations (citing prior literature and referring to Supplementary Table S1). No new patient cohort is presented and no functional mutagenesis is described for this residue, so this is best classified as a review-style mention of known variants rather than original_data or in_vitro. The paper does not provide an HGVS cDNA-level notation for G70S, so variant_c is recorded as 'Not specified'. Confidence: High for protein-level extraction; High that cDNA is not provided in the supplied text.",Unknown,Not found,Discussion (sentence mentioning 'G70S' and developmental and epileptic encephalopathies),"The provided text mentions that de novo EEF1A2 mutations (including G70S) are associated with developmental and epileptic encephalopathies, but it does not describe any patient-observed clinical symptoms for individuals with p.Gly70Ser specifically (or any individual patients).",0,,Entire provided paper text,No individual patient cases with EEF1A2 p.Gly70Ser are described (no sex/age/seizure onset/status or patient-level clinical symptoms). The text is mechanistic/biophysical and only references a general disease association without patient details.
EEF1A2,NM_001958.5,c.208G>A,p.Gly70Ser,Pathogenic,PMC10869706,EEF1A2,EEF1A2,Not specified,p.Gly70Ser,cited_literature,Not specified,Results section: subsection 'Chp1 binds and stabilizes eEF1A F98C missense variant' (variant list in text) and Fig. 5 legend/panel a-b,EEF1A2 pathogenic variant listed as G70S in patient-associated variant set.,"The paper explicitly states that 'Sequence variants in EEF1A2 have been found in patients...' and then lists nine polymorphisms/variants including G70S. This is not presented as a newly discovered human variant in this study but as previously identified patient variants used for yeast experiments; therefore classified as cited_literature. No HGVS cDNA notation is provided anywhere in the provided text, only protein-level shorthand.",Unknown,Not found,Main text (Results/Discussion) where EEF1A2 variants including G70S are listed,"The paper mentions that EEF1A2 variants (including G70S / p.Gly70Ser) have been found in patients with neurodevelopmental epilepsy/intellectual disability and refers generally to epileptic-dyskinetic encephalopathy and cortical/cerebellar atrophy, but it does not describe any clinical symptoms specifically observed in patients with the p.Gly70Ser variant, nor any individual-level clinical phenotype data.",0,,Entire provided text,No individual patients carrying EEF1A2 p.Gly70Ser are described (no case descriptions with age/sex/seizure onset/status or patient-specific clinical symptoms).
EEF1A2,NM_001958.5,c.208G>A,p.Gly70Ser,Pathogenic,PMC10515156,EEF1A2,EEF1A2,Not specified,p.Gly70Ser,cited_literature,Not specified,"Introduction: sentence 'Three common disease-causing mutations in EEF1A2 ... are G70S, E122K, D252H'",G70S listed as a common disease-causing EEF1A2 mutation in prior patients.,"The paper explicitly names 'G70S' among 'common disease-causing mutations ... found in patients' with citation context (refs 6–9), without presenting patient sequencing data in this manuscript. No HGVS cDNA notation is provided, so only the protein-level substitution can be extracted with confidence.",Unknown,"epilepsy, seizures, autism, intellectual disability, attention deficit hyperactivity disorder (ADHD), sleep disturbances, neurodevelopmental delay, global developmental delay","Introduction (ASD comorbidities listed; statement that de novo EEF1A2 mutations incl. G70S found in patients with severe drug-resistant epilepsy, autism, and intellectual disability); Discussion (patients with EEF1A2 mutations: severe drug-resistant seizures, intellectual disability, autism, global neurodevelopmental delay)","The paper mentions clinical features reported in patients with EEF1A2 disease-associated mutations including G70S (p.Gly70Ser), but does not provide individual-level case descriptions for the G70S variant.",0,,Not found (no individual patient case descriptions for EEF1A2 p.Gly70Ser in provided text),Only general statements about patient phenotypes associated with EEF1A2 mutations (including G70S) are provided; no explicit individual patient sex/age/seizure onset/status or per-patient symptom lists are described.
EEF1A2,NM_001958.5,c.208G>A,p.Gly70Ser,Pathogenic,PMC8268798,EEF1A2,EEF1A2,Not specified,p.Gly70Ser,review,Not specified,"Section 3, paragraph: 'most frequently occurring mutation... is p.(G70S)' and subsequent discussion of CRISPR/Cas9 mouse line encoding this replacement",EEF1A2 p.Gly70Ser discussed as the most frequent patient mutation and modeled in mice.,"The review text states 'the most frequently occurring mutation in the EEF1A2 gene from these patients is p.(G70S)' and describes creation of a mouse line encoding this amino acid replacement. Although an in vivo model is discussed, the paper does not present new variant discovery; it summarizes prior human findings and published modeling work. No cDNA HGVS is provided. Confidence High for protein change; source_type set to review because it is discussed in a review context rather than as newly generated experimental variant construction details in this paper.",Unknown,"epilepsy, seizures, intellectual disability",Section 3 “Involvement of eEF1A2 in Genetic Disorders” (paragraph describing de novo missense mutations in EEF1A2 and noting p.(G70S) as the most frequently occurring mutation),The review explicitly links EEF1A2 de novo missense variants (including the most frequent p.G70S) to epilepsy/seizures and intellectual disabilities in affected children; no individual-level additional clinical symptoms are provided for p.G70S specifically.,0,,Entire provided text (review narrative; no case vignettes or individual patient descriptions for p.Gly70Ser),"No individual patients with EEF1A2 p.Gly70Ser are described with sex, age, seizure onset/status, or patient-specific phenotype details; only general statements about associated phenotypes are provided."
