Gene,transcript,hgvsc,hgvsp,Germline classification,paper_id,target_gene,gene,variant_c,variant_p,source_type,frequency,location_in_paper,summary,reasoning,fulltext_source,phenotype_data,phenotype_location,phenotype_reasoning,patient_count,patient_data,patient_location,patient_reasoning
EEF1A2,NM_001958.5,c.208G>A,p.Gly70Ser,Pathogenic,PMC7292794,EEF1A2,EEF1A2,Not specified,p.Gly70Ser,original_data,n=2,Results: 'Whole exome and targeted resequencing' paragraph 1,Recurrent de novo missense variant reported in this cohort.,"In the Results section describing variants identified in 14 patients, the paper explicitly lists recurrent variants including p.G70S with count n=2; no cDNA-level HGVS is provided in the excerpt, so variant_c is recorded as Not specified. Context is this paper's newly identified patient cohort, thus source_type=original_data. Confidence high because protein HGVS and recurrence count are explicitly stated.",Unknown,"Epilepsy, seizures, developmental delay, global developmental delay, intellectual disability (moderate to profound), expressive language impairment, speech impairment (often nonverbal), hypotonia (truncal/generalized; including neonatal hypotonia), movement disorder (choreoathetosis, dystonia), ataxia/ataxic gait, developmental regression, neurodegeneration, autistic features/autism spectrum disorder, aggression, bruxism, self-injurious behavior, hyporesponsiveness to environment, failure to thrive, acquired microcephaly, dysphagia, respiratory dysfunction (including respiratory failure), hyperpnea alternating with apnea",RESULTS—Clinical characteristics and DISCUSSION (general cohort description; includes mention that p.G70S is recurrent but no per-patient phenotype given for the p.G70S individuals),"The paper provides aggregated clinical symptoms across the 29 affected individuals with EEF1A2 pathogenic/likely pathogenic variants; p.Gly70Ser is stated to be recurrent, but the text excerpt does not describe clinical symptoms for the specific p.Gly70Ser patients individually.",0,,"RESULTS—Whole exome and targeted resequencing (p.G70S noted n=2, but no individual clinical descriptions for those patients in the provided text)",No individual patient-level clinical details (sex/age/seizure onset/status/phenotypes) are explicitly provided for the p.Gly70Ser carriers in the supplied excerpt; only cohort-level summaries are given.
EEF1A2,NM_001958.5,c.208G>A,p.Gly70Ser,Pathogenic,PMC4947865,EEF1A2,EEF1A2,c.208G>A,p.Gly70Ser,original_data,"1 case (this study, case 1)",Results section: Case 1; Table 1; Table 3 (G208A / G70S),De novo missense variant reported in this study (case 1).,"In the Results 'Case 1' narrative, the paper explicitly states a heterozygous de novo EEF1A2 variant 'c.208G->A (p.G70S)'. This is reiterated in Table 1 as 'Gly70Ser' and in Table 3 as 'G208A' corresponding to c.208G>A; therefore extracted as original_data with high confidence.",Unknown,"Severe intellectual disability, autistic features, aggressive behaviors, seizures (myoclonic seizures, absence seizures, tonic-clonic/grand mal seizures), epileptic encephalopathy, refractory epilepsy, limited comprehension, nonverbal, global developmental delay, hypotonia, dysphagia",Introduction (previously published Gly70Ser cases: de Ligt et al. 2012; Veeramah et al. 2013) and Results > Clinical findings/case studies > Case 1; Table 1 (Gly70Ser rows),"The text describes multiple individuals with the target variant (p.Gly70Ser) and explicitly reports their clinical symptoms (ID/developmental delay, autism/behavioral features, seizure types/status, hypotonia, dysphagia, language impairment).",3,"[{""patient_id"": ""de Ligt et al. 2012 (Gly70Ser female)"", ""sex"": ""Female"", ""age"": ""22 years"", ""seizure_onset"": ""Not stated"", ""seizure_status"": ""Not stated"", ""phenotypes"": ""Severe intellectual disability, autistic features, aggressive behaviors, seizures (myoclonic seizures, absence seizures, tonic-clonic/grand mal seizures), global developmental delay, hypotonia""}, {""patient_id"": ""Veeramah et al. 2013 (Gly70Ser male)"", ""sex"": ""Male"", ""age"": ""14 years"", ""seizure_onset"": ""Not stated"", ""seizure_status"": ""Refractory epilepsy"", ""phenotypes"": ""Infantile spasms, myoclonic seizures, refractory epilepsy, limited comprehension, nonverbal, gait instability""}, {""patient_id"": ""This study, Case 1 (Gly70Ser)"", ""sex"": ""Female"", ""age"": ""3 years"", ""seizure_onset"": ""2 months"", ""seizure_status"": ""Ongoing seizures (decreased to 1–2 per day)"", ""phenotypes"": ""Epileptic encephalopathy, seizures (myoclonic seizures, tonic-clonic seizures, absence seizures), global developmental delay, hypotonia, dysphagia, unable to walk""}]","Introduction (de Ligt et al. 2012; Veeramah et al. 2013), Results > Clinical findings/case studies > Case 1, Table 1 (Gly70Ser rows). Note: Yang et al. 2014 Gly70Ser case lacks patient-level clinical details beyond broad categorization.","Three Gly70Ser individuals have explicit patient-level clinical descriptions (sex/age and symptoms). The Yang et al. 2014 Gly70Ser case does not provide extractable clinical symptom detail beyond a non-specific category, so it is not included as an individual patient record."
EEF1A2,NM_001958.5,c.208G>A,p.Gly70Ser,Pathogenic,PMC4250081,EEF1A2,EEF1A2,Not specified,p.Gly70Ser,cited_literature,Not specified,"Discussion section, paragraph beginning 'The recent discovery of missense mutations in eEF1A2...'",EEF1A2 missense variant G70S mentioned as literature-reported epilepsy/ID/autism-associated mutation.,"The paper explicitly states: '...missense mutations in eEF1A2... as the G70S mutation abuts the eEF1B binding site[34],[35].' This is a protein-level variant (G70S) in EEF1A2, cited with references [34],[35], and is not presented as new patient data in this study. No HGVS cDNA notation is provided in the text, so variant_c is recorded as 'Not specified'. Confidence: High (explicit variant and gene given).",Unknown,Not found,"Discussion (mentions epilepsy, severe intellectual disability, autism in general for EEF1A2 missense mutations; G70S referenced only as a mutation near binding site)","The provided text is a functional/cell biology study and does not describe any individual patients with EEF1A2 p.Gly70Ser or report observed clinical symptoms in carriers; it only generically mentions that EEF1A2 missense mutations can cause epilepsy, severe intellectual disability, and autism without linking to specific patients/variant carriers.",0,,Entire provided text,No individual patient cases are described for EEF1A2 p.Gly70Ser (no sex/age/seizure history/phenotype details). The only phenotype terms appear as general background statements without patient-level data.
EEF1A2,NM_001958.5,c.208G>A,p.Gly70Ser,Pathogenic,PMC3700577,EEF1A2,EEF1A2,Not specified,p.Gly70Ser,original_data,1 patient (Proband B),Results section -> 'Genes previously associated with severe epilepsy' paragraph mentioning EEF1A2,De novo missense variant p.Gly70Ser reported in EEF1A2 in this study (Proband B).,"In the Results section under 'Genes previously associated with severe epilepsy', the paper explicitly states: 'Proband B possesses a non-synonymous mutation, p.Gly70Ser, in EEF1A2'. This is presented as a mutation found in their sequenced cohort (trio-based WES), i.e., original data from this paper. No corresponding cDNA-level HGVS (c.) notation is provided anywhere in the provided text, so variant_c is recorded as 'Not specified'. Confidence: High (clear HGVS-like protein notation and direct attribution to a proband in this study).",Unknown,"epilepsy, seizures, severe psychomotor developmental delay, autistic features","Results → Genes previously associated with severe epilepsy (EEF1A2 p.Gly70Ser paragraph referencing de Ligt et al., 2012, trio 91)",The paper explicitly states that the same EEF1A2 p.Gly70Ser variant was reported in a child with epilepsy onset at 4 months followed by severe psychomotor developmental delay and autistic features.,1,"[{""patient_id"": ""Proband B"", ""sex"": ""Not specified"", ""age"": ""Not specified"", ""seizure_onset"": ""Not specified"", ""seizure_status"": ""Not specified"", ""phenotypes"": ""epilepsy, seizures""}]","Results → Genes previously associated with severe epilepsy (statement: 'Proband B possesses... p.Gly70Ser, in EEF1A2')","This paper identifies Proband B as carrying EEF1A2 p.Gly70Ser, but provides no Proband B-specific clinical symptom details in the provided text beyond being part of an epilepsy cohort; the additional detailed phenotypes (4-month onset epilepsy, severe psychomotor delay, autistic features) are described for an external case (de Ligt et al., 2012 trio 91) without individual patient demographics here."
EEF1A2,NM_001958.5,c.46G>C,p.Val16Leu,Likely pathogenic,PMC8268798,EEF1A2,EEF1A2,Not specified,p.Val16Leu,review,Not specified,"Section 3 (Involvement of eEF1A2 in Genetic Disorders), paragraph mentioning cardiomyopathy-associated variants: 'p.V16L [91]'",EEF1A2 p.Val16Leu mentioned as a pathogenic variant associated with cardiomyopathy (cited).,"In the same Section 3 discussion of disease involvement, the authors cite 'p.V16L [91]' as an EEF1A2 variant (heterozygous) associated with dilated cardiomyopathy. No cDNA notation is given. Classified as review because it is not novel data generated here but a summary of prior reports. Confidence High.",Unknown,Not found,"Section 3 (Involvement of eEF1A2 in Genetic Disorders) mentions p.V16L in relation to cardiomyopathy, but does not describe clinical symptoms in a specific patient with p.Val16Leu.","The provided text is a general review statement noting association of p.V16L with dilated cardiomyopathy, without any explicit patient-level clinical symptom description for the p.Val16Leu variant.",0,,Entire provided text (notably Section 3).,No individual patient with EEF1A2 p.Val16Leu is described with sex/age/seizure onset/status or clinical symptom list; only a nonspecific association is mentioned.
